{
  "$id": "urn:ratatoskr:contracts:sites:v1:BundleManifest",
  "$schema": "https://json-schema.org/draft/2020-12/schema",
  "title": "BundleManifest",
  "description": "Contract `sites/bundle-manifest.v1`: the file `ratatoskr-bundle.json` at the root of a site\nbundle.\n\nIt names the site, the repository and the commit that built the bundle, the entry document,\nwhether the gateway answers an unknown path with the entry document, and every file of the\nbundle with its size, SHA-256 and `hashed` flag. The archive holds no file that the manifest\ndoes not list (workspace spec `site-bundles`). Every other member is refused.\n\n`Deserialize` is hand-written because two rules span the file list: the files are sorted by\npath with each path once, and the entry document is one of them. It parses a private mirror\nstruct and then calls [`BundleManifest::validate`].",
  "type": "object",
  "properties": {
    "commit": {
      "description": "The commit that the bundle was built from.",
      "$ref": "#/$defs/CommitSha"
    },
    "entry_document": {
      "description": "The file that the gateway serves for `/`, and for an unknown path when `entry_fallback` is\non.",
      "$ref": "#/$defs/BundlePath"
    },
    "entry_fallback": {
      "description": "`true` when the gateway answers a path that the bundle does not hold with the entry\ndocument, as a single-page application needs. Never for a path under `/.ratatoskr/`.",
      "type": "boolean"
    },
    "files": {
      "description": "Every file of the bundle, in ascending order of path, each path once.",
      "type": "array",
      "items": {
        "$ref": "#/$defs/BundleFile"
      }
    },
    "repository": {
      "description": "The repository that built the bundle.",
      "$ref": "#/$defs/RepositoryName"
    },
    "site_id": {
      "description": "The site that the bundle is for. A deploy to another site is refused.",
      "$ref": "#/$defs/SiteId"
    }
  },
  "additionalProperties": false,
  "required": [
    "commit",
    "entry_document",
    "entry_fallback",
    "files",
    "repository",
    "site_id"
  ],
  "x-ratatoskr-provenance": {
    "canonical_source": "ratatoskr_sites_contracts::BundleManifest",
    "contract_id": "sites.bundle_manifest",
    "contract_major_version": 1,
    "generated": "DO NOT EDIT — generated by contractsc from the canonical Rust source. Change the Rust type and run `cargo contracts generate`.",
    "generator": "contractsc",
    "generator_version": "0.1.0",
    "schemars_version": "1.2.2",
    "source_digest": "sha256:aea4de0ed5cb7efe1013c344a8d709713f64a07ab6a87ecd44c7708ad88590f3",
    "validation_note": "This schema is a LOWER BOUND on validity. Cross-field invariants and canonical-form rules are enforced by the canonical Rust type; see fixtures/invalid-expectations.toml for which layer rejects what."
  },
  "$defs": {
    "BundleFile": {
      "description": "One file of a [`BundleManifest`].",
      "type": "object",
      "properties": {
        "hashed": {
          "description": "`true` when the file name carries a hash of its content, so the gateway marks it\n`immutable` and may serve it from the previous deploy.",
          "type": "boolean"
        },
        "path": {
          "description": "The path of the file in the bundle.",
          "$ref": "#/$defs/BundlePath"
        },
        "sha256": {
          "description": "The lowercase hex SHA-256 of the file bytes; the gateway sends it as the `ETag`.",
          "$ref": "#/$defs/DigestHex"
        },
        "size_bytes": {
          "description": "The length of the file bytes, at most 2^53 - 1.",
          "type": "integer",
          "format": "uint64",
          "maximum": 9007199254740991,
          "minimum": 0
        }
      },
      "additionalProperties": false,
      "required": [
        "hashed",
        "path",
        "sha256",
        "size_bytes"
      ]
    },
    "BundlePath": {
      "title": "BundlePath",
      "description": "The path of one file of a site bundle, relative to the bundle root.\n\nSegments separated by `/`, at most 1024 UTF-8 bytes, no leading or trailing `/`, no empty,\n`.` or `..` segment, no backslash and no C0 or DEL control character, so a path never names\na file outside the bundle. The first segment is never `_r`, which the gateway reserves for\nforwarding to Edge; `.ratatoskr/`, the reserved path for SDK pages, is accepted (workspace\nspec `site-bundles`). The path is in Unicode NFC; this contract does not check NFC, and the\nproducer normalises every path.\n\nThe length bound is 1024 UTF-8 bytes, because a file system limits a path in bytes. The Rust\ntype checks bytes. The `maxLength` of this schema is the same number, but JSON Schema counts\ncharacters, so the schema accepts a path of at most 1024 characters whose UTF-8 form is\nlonger than 1024 bytes, and the Rust type refuses it. A producer checks the byte length.",
      "type": "string",
      "examples": [
        "index.html",
        "assets/index-4f2a9c.js",
        ".ratatoskr/sign-in/index.html"
      ],
      "maxLength": 1024,
      "pattern": "^(?:[^._/\\\\\\x00-\\x1f\\x7f][^/\\\\\\x00-\\x1f\\x7f]*|\\.[^./\\\\\\x00-\\x1f\\x7f][^/\\\\\\x00-\\x1f\\x7f]*|\\.\\.[^/\\\\\\x00-\\x1f\\x7f]+|_|_[^r/\\\\\\x00-\\x1f\\x7f][^/\\\\\\x00-\\x1f\\x7f]*|_r[^/\\\\\\x00-\\x1f\\x7f]+)(?:/(?:[^./\\\\\\x00-\\x1f\\x7f]|\\.[^./\\\\\\x00-\\x1f\\x7f]|\\.\\.[^/\\\\\\x00-\\x1f\\x7f])[^/\\\\\\x00-\\x1f\\x7f]*)*$"
    },
    "CommitSha": {
      "title": "CommitSha",
      "description": "A full Git commit id: 40 lowercase hexadecimal characters.",
      "type": "string",
      "examples": [
        "3f6c2a9e8b1d4c7f0a5e2b9d6c3f8a1e4b7d0c2f"
      ],
      "maxLength": 40,
      "pattern": "^[0-9a-f]{40}$"
    },
    "DigestHex": {
      "title": "DigestHex",
      "description": "Lowercase hexadecimal bytes of a content digest.",
      "type": "string",
      "examples": [
        "0000000000000000000000000000000000000000000000000000000000000000"
      ],
      "maxLength": 64,
      "pattern": "^[0-9a-f]{64}$"
    },
    "RepositoryName": {
      "title": "RepositoryName",
      "description": "The GitHub repository that built the bundle, as `owner/name`.\n\nThe owner has 1 to 39 ASCII letters, digits and `-` and starts with a letter or digit; the\nname has 1 to 100 ASCII letters, digits, `.`, `_` and `-`.",
      "type": "string",
      "examples": [
        "owner/docs-site"
      ],
      "maxLength": 140,
      "pattern": "^[A-Za-z0-9][A-Za-z0-9-]{0,38}/[A-Za-z0-9._-]{1,100}$"
    },
    "SiteId": {
      "title": "SiteId",
      "description": "The id of one site: 3 to 40 lower-case ASCII letters, digits and `-`.\n\nThe grammar is the `site:<site id>` form of `WriteOrigin` in `ratatoskr-notes-contracts`.\nThe owner chooses the id, and it appears in every route under `/v1/sites/{site}/`.",
      "type": "string",
      "examples": [
        "docs",
        "garden-2026"
      ],
      "maxLength": 40,
      "pattern": "^[a-z0-9-]{3,40}$"
    }
  }
}
